{
  "schema_version": "2.0",
  "run_id": "example-run-001",
  "candidate_sha": "0123456789abcdef0123456789abcdef01234567",
  "scope": "full_integrated",
  "status": "PASS",
  "commands": [
    {
      "command": "pnpm check",
      "status": "PASS",
      "evidence": "/absolute/evidence/pnpm-check.log"
    }
  ],
  "evidence": [
    "/absolute/evidence/final-validation-summary.md"
  ],
  "recorded_at": "2026-08-06T00:00:00Z"
}
